{
  "question_id": "nbme-gen-004",
  "generated_date": "2026-04-05",
  "source_concepts": ["cocaine-induced-lung-toxicity"],
  "source_uworld": "20900",
  "system": "Pulmonary & Critical Care",
  "topic": "Cocaine-Induced Lung Toxicity",
  "subtopic": "Diagnosis",
  "difficulty": "medium",
  "question_type": "most-likely-diagnosis",
  "stem": "A 32-year-old man is brought to the emergency department by his roommate for acute onset of severe dyspnea and cough. On physical examination, he is restless and tachycardic with a blood pressure of 165/95 mmHg. Multiple small, circular burns are noted on the tips of his fingers. Lung auscultation reveals diffuse inspiratory crackles, and pulse oximetry shows an oxygen saturation of 84% on room air. Chest radiography demonstrates diffuse bilateral airspace opacities with a normal cardiomediastinal silhouette.",
  "lead_in": "Which of the following is the most likely diagnosis?",
  "options": {
    "A": "Acute cardiogenic pulmonary edema",
    "B": "Cocaine-induced diffuse alveolar hemorrhage",
    "C": "Pulmonary embolism",
    "D": "Pulmonary fibrosis",
    "E": "Viral pneumonitis"
  },
  "correct_answer": "B",
  "explanation": "The patient presents with a sympathomimetic toxidrome (tachycardia, hypertension, restlessness) and signs of acute lung injury. The presence of fingertip burns is a highly specific finding for the use of hot pipes to inhale cocaine (crack). Diffuse bilateral opacities on chest X-ray with a normal heart size distinguish this from cardiogenic pulmonary edema. The constellation of recent cocaine use, acute hypoxemia, and ground-glass opacities is characteristic of cocaine-induced diffuse alveolar hemorrhage (DAH). Pulmonary embolism typically presents with clear lungs on X-ray, and pulmonary fibrosis is a chronic, insidious process rather than an acute presentation.",
  "teaching_point": "Cocaine-induced lung toxicity presents as diffuse alveolar hemorrhage, often signaled by a sympathomimetic toxidrome and characteristic fingertip burns from hot-pipe inhalation.",
  "distractor_rationale": {
    "A": "Incorrect: The normal cardiomediastinal silhouette and sympathomimetic state make cardiogenic edema less likely.",
    "B": "Correct: Classic presentation of crack-induced DAH.",
    "C": "Incorrect: PE usually shows clear lungs on CXR, not diffuse airspace opacities.",
    "D": "Incorrect: Fibrosis is a chronic process with interstitial thickening, not acute opacification.",
    "E": "Incorrect: While viral pneumonia causes opacities, it lacks the specific sympathomimetic and fingertip burn findings."
  },
  "tags": ["step2", "pulmonary", "cocaine", "dah"],
  "review_status": "reviewed",
  "reviewer_notes": "Rewritten by nbme-evaluate. Original score: 99/100. Projected: 100/100. Updated distractor D (Fibrosis -> ARDS) for better acute-phase plausibility."
}