{
  "question_id": "nbme-gen-032",
  "generated_date": "2026-04-05",
  "source_concepts": ["pleural-effusion-exam"],
  "source_uworld": "8818",
  "system": "Pulmonary & Critical Care",
  "topic": "Pleural Effusion Physical Exam",
  "question_type": "most-likely-diagnosis",
  "stem": "A 64-year-old woman is evaluated in the clinic for progressive shortness of breath over the last three weeks. She has a history of congestive heart failure and tobacco use. On physical examination, her vital signs are: temperature 37.1°C (98.8°F), pulse 88/min, blood pressure 132/78 mmHg, respiratory rate 22/min, and oxygen saturation 92% on room air. On thoracic examination, she has diminished breath sounds at the right lung base. Percussion of the right lower chest reveals a dull sound. Tactile fremitus is decreased in the affected area. There is no evidence of fever, cough, or purulent sputum.",
  "lead_in": "Which of the following is the most likely finding explaining the physical examination results?",
  "options": {
    "A": "Atelectasis",
    "B": "Lobar pneumonia",
    "C": "Pleural effusion",
    "D": "Pneumothorax",
    "E": "Pulmonary embolism"
  },
  "correct_answer": "C",
  "explanation": "The patient presents with the classic physical examination triad of pleural effusion: decreased breath sounds, dullness to percussion, and decreased tactile fremitus. The fluid in the pleural space acts as an insulator, dampening the transmission of vibrations (decreased fremitus) and sound (decreased breath sounds) from the lung to the chest wall, while increasing the density of the thoracic area (dullness). Lobar pneumonia (consolidation) (B) also causes dullness to percussion, but typically presents with increased tactile fremitus and bronchial breath sounds. Atelectasis (A) also shows decreased breath sounds and decreased fremitus with dullness, but the mediastinum typically shifts toward the affected side, and the clinical context (CHF) more strongly supports effusion. Pneumothorax (D) would cause decreased breath sounds and decreased fremitus, but percussion would reveal hyperresonance (air) rather than dullness. Pulmonary embolism (E) often has a normal physical exam of the lungs unless it leads to infarction or effusion.",
  "teaching_point": "Pleural effusion is characterized by a triad of decreased breath sounds, dullness to percussion, and decreased tactile fremitus.",
  "distractor_rationale": {
    "A": "Presents with dullness and decreased fremitus/breath sounds, but is less likely given the CHF history and lacks the specific shift associated with collapse.",
    "B": "Presents with dullness but increased tactile fremitus and bronchial breath sounds due to consolidation.",
    "C": "Correct: matches the clinical triad of dullness, decreased fremitus, and decreased breath sounds.",
    "D": "Presents with hyperresonance on percussion due to the presence of air in the pleural space.",
    "E": "Typically does not present with these specific physical exam findings unless a secondary effusion develops."
  },
  "tags": ["step2", "medicine", "pulmonary", "pleural-effusion", "physical-exam"],
  "review_status": "draft"
}