{
  "question_id": "nbme-gen-019",
  "generated_date": "2026-04-05",
  "source_concepts": ["bronchiolitis"],
  "source_uworld": "19296",
  "system": "Pulmonary & Critical Care",
  "topic": "Bronchiolitis",
  "question_type": "most-likely-diagnosis",
  "stem": "A 7-month-old boy is brought to the pediatric clinic for an evaluation of a cough and congestion. His mother reports that he had a mild runny nose and sneezing three days ago, but he has since developed a persistent cough and difficulty breathing. On physical examination, the infant is irritable and tachypneic. Vital signs are: temperature 38.1°C (100.6°F), heart rate 148/min, respiratory rate 58/min, and oxygen saturation 91% on room air. Examination of the chest reveals intercostal and subcostal retractions, and auscultation reveals diffuse wheezing and crackles bilaterally. A chest radiograph is performed and shows generalized hyperinflation of the lungs and increased interstitial markings without focal consolidation.",
  "lead_in": "Which of the following is the most likely diagnosis?",
  "options": {
    "A": "Bacterial pneumonia",
    "B": "Bronchiolitis",
    "C": "Cystic fibrosis",
    "D": "Foreign body aspiration",
    "E": "Laryngotracheobronchitis"
  },
  "correct_answer": "B",
  "explanation": "The patient's presentation is classic for bronchiolitis, which typically affects children under 2 years of age. It begins with a viral prodrome (nasal congestion, rhinorrhea) and progresses to lower respiratory tract involvement characterized by wheezing, crackles, tachypnea, and retractions. The chest radiograph findings of hyperinflation and interstitial markings, without focal consolidation, further support the diagnosis of bronchiolitis over pneumonia. Bacterial pneumonia (A) would typically show focal consolidation on CXR. Cystic fibrosis (C) would present with a more chronic course of recurrent infections and failure to thrive. Foreign body aspiration (D) typically presents with sudden onset and asymmetric breath sounds or focal atelectasis. Laryngotracheobronchitis (Croup) (E) is characterized by a barking cough and inspiratory stridor rather than diffuse wheezing and crackles.",
  "teaching_point": "Bronchiolitis in infants presents with a viral prodrome followed by wheezing, crackles, and respiratory distress, with characteristic chest X-ray findings of hyperinflation and interstitial markings.",
  "distractor_rationale": {
    "A": "Typically presents with focal consolidation on chest X-ray.",
    "C": "Associated with a chronic history of recurrent respiratory infections and growth failure.",
    "D": "Usually presents with abrupt onset and localized findings on examination and imaging.",
    "E": "Characterized by a barking cough and stridor rather than diffuse lower airway wheezing."
  },
  "tags": ["step2", "pediatrics", "pulmonary", "bronchiolitis", "rsv"],
  "review_status": "draft"
}