{
  "question_id": "nbme-gen-018",
  "generated_date": "2026-04-05",
  "source_concepts": ["functional-tremor"],
  "source_uworld": "19546",
  "system": "Nervous System",
  "topic": "Functional Tremor",
  "question_type": "most-likely-diagnosis",
  "stem": "A 32-year-old woman comes to the clinic for evaluation of a tremor in her right hand that began abruptly three months ago. She reports that the tremor is most noticeable when she is stressed at work. On physical examination, she is seated and asked to extend her arms forward. A moderate-amplitude tremor is observed in the right hand. When the physician asks the patient to tap her left foot rapidly, the frequency of the right-hand tremor significantly slows. When the physician gently holds the patient's right wrist, the tremor ceases in the wrist and begins to occur in the fingers. However, the patient is able to write a legible sentence on a piece of paper, though she is unable to draw a reasonably accurate spiral.",
  "lead_in": "Which of the following is the most likely diagnosis?",
  "options": {
    "A": "Cerebellar tremor",
    "B": "Essential tremor",
    "C": "Functional tremor",
    "D": "Orthostatic tremor",
    "E": "Physiologic tremor"
  },
  "correct_answer": "C",
  "explanation": "This patient exhibits key characteristics of a functional tremor, specifically variability and inconsistency. The tremor is distractible (frequency changes when tapping the opposite foot) and inconsistent with organic neurological patterns (the tremor 'chase' the restraint by shifting from the wrist to the fingers). Furthermore, the ability to write a sentence while failing to draw a spiral is a classic finding in functional movement disorders. Essential tremor (B) is a consistent action tremor that does not shift in frequency with distraction. Cerebellar tremor (A) is an intention tremor that increases as the target is approached and is usually accompanied by ataxia. Orthostatic tremor (D) occurs only when standing, and physiologic tremor (E) is a low-amplitude, high-frequency tremor augmented by anxiety or caffeine, not characterized by the variability seen here.",
  "teaching_point": "Functional tremors are characterized by variability and inconsistency, such as distractibility, shifting frequency, and 'chasing' restraints, which distinguish them from organic neurological tremors.",
  "distractor_rationale": {
    "A": "An intention tremor that is consistent and associated with ataxia.",
    "B": "A consistent action tremor that does not change frequency with distraction.",
    "D": "Occurs specifically when standing and is not distractible.",
    "E": "A consistent, low-amplitude tremor that worsens with anxiety but does not shift patterns."
  },
  "tags": ["step2", "neurology", "psychiatry", "functional-tremor"],
  "review_status": "draft"
}