{
  "question_id": "nbme-gen-024",
  "generated_date": "2026-04-05",
  "source_concepts": ["massive-hemothorax"],
  "source_uworld": "4539",
  "system": "Pulmonary & Critical Care",
  "topic": "Massive Hemothorax",
  "question_type": "next-best-step",
  "stem": "A 32-year-old man is brought to the emergency department via ambulance after a high-speed motor vehicle collision. He was the unrestrained driver and the only occupant of the vehicle. On arrival, he is conscious but appears pale and diaphoretic. Vital signs are: temperature 36.5°C (97.7°F), pulse 128/min, blood pressure 82/54 mmHg, respiratory rate 28/min, and oxygen saturation 88% on room air. Physical examination reveals diminished breath sounds and dullness to percussion on the left side of the chest. The trachea is slightly deviated to the right. Neck veins are flat. A large-bore intravenous catheter is placed, and the patient is started on an aggressive fluid resuscitation with warmed crystalloids. A tube thoracostomy is performed on the left side, resulting in the immediate drainage of 1,600 mL of blood.",
  "lead_in": "Which of the following is the most appropriate next step in management?",
  "options": {
    "A": "Continue fluid resuscitation and observe",
    "B": "Perform a CT scan of the chest",
    "C": "Perform emergent thoracotomy",
    "D": "Initiate non-invasive positive pressure ventilation",
    "E": "Administer a bolus of intravenous corticosteroids"
  },
  "correct_answer": "C",
  "explanation": "The patient has a massive hemothorax, characterized by hemodynamic instability (hypotension, tachycardia), diminished breath sounds, and dullness to percussion. The immediate drainage of 1,600 mL of blood via tube thoracostomy meets the threshold for emergent thoracotomy (>1,500 mL immediate drainage or >20 mL/kg), as it indicates a massive hemorrhage from a major vessel (e.g., intercostal arteries or internal mammary artery) that requires surgical ligation. CT scanning (B) would delay definitive treatment in an unstable patient. Observation (A) is inappropriate given the volume of blood loss and instability. NPPV (D) is contraindicated in the setting of an untreated thoracic injury and potential hemodynamic collapse. Corticosteroids (E) have no role in the management of acute thoracic trauma.",
  "teaching_point": "Emergent thoracotomy is indicated for a massive hemothorax when there is immediate drainage of >1,500 mL of blood or continued bleeding (>200 mL/hr for 2-4 hours) following tube thoracostomy.",
  "distractor_rationale": {
    "A": "Hemorrhagic shock from a massive hemothorax requires surgical intervention, not just supportive care.",
    "B": "Imaging should not delay life-saving surgery in a hemodynamically unstable patient.",
    "D": "Does not address the underlying hemorrhage and may worsen the condition in an unstable patient.",
    "E": "No indication for steroids in the management of acute traumatic hemorrhage."
  },
  "tags": ["step2", "surgery", "trauma", "massive-hemothorax", "thoracotomy"],
  "review_status": "draft"
}