{
  "question_id": "nbme-gen-017",
  "generated_date": "2026-04-05",
  "source_concepts": ["ethylene-glycol-toxicity"],
  "source_uworld": "4511",
  "system": "Poisoning & Environmental Exposure",
  "topic": "Ethylene Glycol Toxicity",
  "question_type": "most-likely-diagnosis",
  "stem": "A 34-year-old man is brought to the emergency department by his partner after being found unresponsive in the garage. The partner reports that the patient has been struggling with depression and was seen near an open container of automotive antifreeze. On physical examination, the patient is somnolent and minimally responsive to painful stimuli. Vital signs are: temperature 36.2°C (97.2°F), pulse 104/min, blood pressure 102/64 mmHg, respiratory rate 26/min, and oxygen saturation 96% on room air. Pulmonary auscultation is normal. Laboratory studies show a serum sodium of 140 mEq/L, chloride of 102 mEq/L, bicarbonate of 12 mEq/L, and a creatinine of 2.1 mg/dL. Urinalysis is positive for blood and contains numerous envelope-shaped crystals.",
  "lead_in": "Which of the following is the most likely diagnosis?",
  "options": {
    "A": "Aspirin toxicity",
    "B": "Ethylene glycol poisoning",
    "C": "Methanol poisoning",
    "D": "Isopropanol toxicity",
    "E": "Propylene glycol poisoning"
  },
  "correct_answer": "B",
  "explanation": "The patient presents with CNS depression, a high-anion gap metabolic acidosis (HAGMA), and acute kidney injury (AKI), following exposure to antifreeze. The presence of envelope-shaped calcium oxalate crystals in the urine is pathognomonic for ethylene glycol poisoning. Methanol poisoning (C) also causes HAGMA and CNS depression but typically presents with visual disturbances (blurred vision, 'snowstorm' appearance) and is not associated with oxalate crystals or AKI. Aspirin toxicity (A) causes HAGMA but typically presents with tinnitus and respiratory alkalosis. Isopropanol (D) causes an osmolar gap but not a metabolic acidosis, and propylene glycol (E) is less common and typically seen in IV formulations, not as a typical automotive antifreeze.",
  "teaching_point": "Ethylene glycol toxicity presents with CNS depression, HAGMA, and AKI, with calcium oxalate crystals in the urine as a key diagnostic finding.",
  "distractor_rationale": {
    "A": "Causes HAGMA but typically presents with tinnitus and respiratory alkalosis.",
    "C": "Causes HAGMA and CNS depression but presents with visual changes rather than AKI and oxalate crystals.",
    "D": "Causes osmolar gap and CNS depression but does not cause metabolic acidosis.",
    "E": "Less common and typically associated with specific medical formulations rather than antifreeze ingestion."
  },
  "tags": ["step2", "toxicology", "ethylene-glycol", "HAGMA", "AKI"],
  "review_status": "draft"
}